No.;Time;Source;Destination;Protocol;Length;Info;;;;;;;;;;time 1;time 2;delay;;Delay 2;Delay 3;Jitter
1;0;10.120.93.121;199.232.46.248;TCP;55;60917  >  443 [ACK] Seq=1 Ack=1 Win=399 Len=1 [TCP segment of a reassembled PDU];;;;;;;;;;0;0,031397;0,031397;;-3,177517;3,208914;6,386431
2;0,031397;199.232.46.248;10.120.93.121;TCP;66;443  >  60917 [ACK] Seq=1 Ack=2 Win=295 Len=0 SLE=1 SRE=2;;;;;;;;;;0,031397;3,240311;3,208914;;3,183454;0,02546;-3,157994
3;3,240311;10.120.93.121;199.232.46.248;TCP;55;60922  >  443 [ACK] Seq=1 Ack=1 Win=1057 Len=1 [TCP segment of a reassembled PDU];;;;;;;;;;3,240311;3,265771;0,02546;;-0,971267;0,996727;1,967994
4;3,265771;199.232.46.248;10.120.93.121;TCP;66;443  >  60922 [ACK] Seq=1 Ack=2 Win=306 Len=0 SLE=1 SRE=2;;;;;;;;;;3,265771;4,262498;0,996727;;0,940527;0,0562;-0,884327
5;4,262498;10.120.93.121;35.186.224.39;TLSv1.2;97;Application Data;;;;;;;;;;4,262498;4,318698;0,0562;;0,017228;0,038972;0,021744
6;4,318698;35.186.224.39;10.120.93.121;TCP;60;443  >  61011 [ACK] Seq=1 Ack=44 Win=283 Len=0;;;;;;;;;;4,318698;4,35767;0,038972;;0,036388;0,002584;-0,033804
7;4,35767;10.120.93.121;118.98.113.218;TLSv1.2;891;Application Data;;;;;;;;;;4,35767;4,360254;0,002584;;-0,037237;0,039821;0,077058
8;4,360254;35.186.224.39;10.120.93.121;TLSv1.2;94;Application Data;;;;;;;;;;4,360254;4,400075;0,039821;;0,039159;0,000662;-0,038497
9;4,400075;10.120.93.121;35.186.224.39;TCP;54;61011  >  443 [ACK] Seq=44 Ack=41 Win=256 Len=0;;;;;;;;;;4,400075;4,400737;0,000662;;-0,00094;0,001602;0,002542
10;4,400737;118.98.113.218;10.120.93.121;TLSv1.2;670;Application Data;;;;;;;;;;4,400737;4,402339;0,001602;;0,001602;0;-0,001602
11;4,402339;118.98.113.218;10.120.93.121;TCP;1514;443  >  61020 [ACK] Seq=617 Ack=838 Win=275 Len=1460 [TCP segment of a reassembled PDU];;;;;;;;;;4,402339;4,402339;0;;-0,000142;0,000142;0,000284
12;4,402339;118.98.113.218;10.120.93.121;TCP;1514;443  >  61020 [ACK] Seq=2077 Ack=838 Win=275 Len=1460 [TCP segment of a reassembled PDU];;;;;;;;;;4,402339;4,402481;0,000142;;-0,003369;0,003511;0,00688
13;4,402481;10.120.93.121;118.98.113.218;TCP;54;61020  >  443 [ACK] Seq=838 Ack=3537 Win=524 Len=0;;;;;;;;;;4,402481;4,405992;0,003511;;0,003511;0;-0,003511
14;4,405992;118.98.113.218;10.120.93.121;TCP;1514;443  >  61020 [ACK] Seq=3537 Ack=838 Win=275 Len=1460 [TCP segment of a reassembled PDU];;;;;;;;;;4,405992;4,405992;0;;-0,000163;0,000163;0,000326
15;4,405992;118.98.113.218;10.120.93.121;TCP;1514;443  >  61020 [ACK] Seq=4997 Ack=838 Win=275 Len=1460 [TCP segment of a reassembled PDU];;;;;;;;;;4,405992;4,406155;0,000163;;-0,003223;0,003386;0,006609
16;4,406155;10.120.93.121;118.98.113.218;TCP;54;61020  >  443 [ACK] Seq=838 Ack=6457 Win=524 Len=0;;;;;;;;;;4,406155;4,409541;0,003386;;0,003247;0,000139;-0,003108
17;4,409541;118.98.113.218;10.120.93.121;TCP;1514;443  >  61020 [ACK] Seq=6457 Ack=838 Win=275 Len=1460 [TCP segment of a reassembled PDU];;;;;;;;;;4,409541;4,40968;0,000139;;-0,007627;0,007766;0,015393
18;4,40968;10.120.93.121;118.98.113.218;TCP;54;61020  >  443 [ACK] Seq=838 Ack=7917 Win=524 Len=0;;;;;;;;;;4,40968;4,417446;0,007766;;0,007766;0;-0,007766
19;4,417446;118.98.113.218;10.120.93.121;TCP;1514;443  >  61020 [ACK] Seq=7917 Ack=838 Win=275 Len=1460 [TCP segment of a reassembled PDU];;;;;;;;;;4,417446;4,417446;0;;-0,000163;0,000163;0,000326
20;4,417446;118.98.113.218;10.120.93.121;TCP;1514;443  >  61020 [ACK] Seq=9377 Ack=838 Win=275 Len=1460 [TCP segment of a reassembled PDU];;;;;;;;;;4,417446;4,417609;0,000163;;-0,011247;0,01141;0,022657
21;4,417609;10.120.93.121;118.98.113.218;TCP;54;61020  >  443 [ACK] Seq=838 Ack=10837 Win=524 Len=0;;;;;;;;;;4,417609;4,429019;0,01141;;0,01141;0;-0,01141
22;4,429019;118.98.113.218;10.120.93.121;TCP;1514;443  >  61020 [ACK] Seq=10837 Ack=838 Win=275 Len=1460 [TCP segment of a reassembled PDU];;;;;;;;;;4,429019;4,429019;0;;-0,000167;0,000167;0,000334
23;4,429019;118.98.113.218;10.120.93.121;TCP;1514;443  >  61020 [ACK] Seq=12297 Ack=838 Win=275 Len=1460 [TCP segment of a reassembled PDU];;;;;;;;;;4,429019;4,429186;0,000167;;-0,000043;0,00021;0,000253
24;4,429186;10.120.93.121;118.98.113.218;TCP;54;61020  >  443 [ACK] Seq=838 Ack=13757 Win=524 Len=0;;;;;;;;;;4,429186;4,429396;0,00021;;-0,030931;0,031141;0,062072
25;4,429396;118.98.113.218;10.120.93.121;TCP;1514;443  >  61020 [ACK] Seq=13757 Ack=838 Win=275 Len=1460 [TCP segment of a reassembled PDU];;;;;;;;;;4,429396;4,460537;0,031141;;0,031141;0;-0,031141
26;4,460537;118.98.113.218;10.120.93.121;TCP;1514;443  >  61020 [ACK] Seq=15217 Ack=838 Win=275 Len=1460 [TCP segment of a reassembled PDU];;;;;;;;;;4,460537;4,460537;0;;-0,000163;0,000163;0,000326
27;4,460537;118.98.113.218;10.120.93.121;TLSv1.2;1514;Application Data [TCP segment of a reassembled PDU];;;;;;;;;;4,460537;4,4607;0,000163;;-0,000064;0,000227;0,000291
28;4,4607;10.120.93.121;118.98.113.218;TCP;54;61020  >  443 [ACK] Seq=838 Ack=18137 Win=524 Len=0;;;;;;;;;;4,4607;4,460927;0,000227;;0,000159;6,80E-05;-0,000091
29;4,460927;118.98.113.218;10.120.93.121;TCP;1514;443  >  61020 [ACK] Seq=18137 Ack=838 Win=275 Len=1460 [TCP segment of a reassembled PDU];;;;;;;;;;4,460927;4,460995;6,80E-05;;-0,000097;0,000165;0,000262
30;4,460995;10.120.93.121;118.98.113.218;TCP;54;61020  >  443 [ACK] Seq=838 Ack=19597 Win=524 Len=0;;;;;;;;;;4,460995;4,46116;0,000165;;0,000165;0;-0,000165
31;4,46116;118.98.113.218;10.120.93.121;TCP;1514;443  >  61020 [ACK] Seq=19597 Ack=838 Win=275 Len=1460 [TCP segment of a reassembled PDU];;;;;;;;;;4,46116;4,46116;0;;-0,000081;8,10E-05;0,000162
32;4,46116;118.98.113.218;10.120.93.121;TCP;1514;443  >  61020 [ACK] Seq=21057 Ack=838 Win=275 Len=1460 [TCP segment of a reassembled PDU];;;;;;;;;;4,46116;4,461241;8,10E-05;;-0,000072;0,000153;0,000225
33;4,461241;10.120.93.121;118.98.113.218;TCP;54;61020  >  443 [ACK] Seq=838 Ack=22517 Win=524 Len=0;;;;;;;;;;4,461241;4,461394;0,000153;;0,000153;0;-0,000153
34;4,461394;118.98.113.218;10.120.93.121;TCP;1514;443  >  61020 [ACK] Seq=22517 Ack=838 Win=275 Len=1460 [TCP segment of a reassembled PDU];;;;;;;;;;4,461394;4,461394;0;;-0,000077;7,70E-05;0,000154
35;4,461394;118.98.113.218;10.120.93.121;TCP;1514;443  >  61020 [ACK] Seq=23977 Ack=838 Win=275 Len=1460 [TCP segment of a reassembled PDU];;;;;;;;;;4,461394;4,461471;7,70E-05;;-0,000083;0,00016;0,000243
36;4,461471;10.120.93.121;118.98.113.218;TCP;54;61020  >  443 [ACK] Seq=838 Ack=25437 Win=524 Len=0;;;;;;;;;;4,461471;4,461631;0,00016;;0,00016;0;-0,00016
37;4,461631;118.98.113.218;10.120.93.121;TCP;1514;443  >  61020 [ACK] Seq=25437 Ack=838 Win=275 Len=1460 [TCP segment of a reassembled PDU];;;;;;;;;;4,461631;4,461631;0;;-0,000089;8,90E-05;0,000178
38;4,461631;118.98.113.218;10.120.93.121;TCP;1514;[TCP Previous segment not captured] 443  >  61020 [ACK] Seq=28357 Ack=838 Win=275 Len=1460 [TCP segment of a reassembled PDU];;;;;;;;;;4,461631;4,46172;8,90E-05;;-0,000068;0,000157;0,000225
39;4,46172;10.120.93.121;118.98.113.218;TCP;66;61020  >  443 [ACK] Seq=838 Ack=26897 Win=524 Len=0 SLE=28357 SRE=29817;;;;;;;;;;4,46172;4,461877;0,000157;;0,000068;8,90E-05;0,000021
40;4,461877;118.98.113.218;10.120.93.121;TCP;1514;[TCP Out-Of-Order] 443  >  61020 [ACK] Seq=26897 Ack=838 Win=275 Len=1460 [TCP segment of a reassembled PDU];;;;;;;;;;4,461877;4,461966;8,90E-05;;-0,000079;0,000168;0,000247
41;4,461966;10.120.93.121;118.98.113.218;TCP;54;61020  >  443 [ACK] Seq=838 Ack=29817 Win=524 Len=0;;;;;;;;;;4,461966;4,462134;0,000168;;0,00002;0,000148;0,000128
42;4,462134;118.98.113.218;10.120.93.121;TCP;1514;443  >  61020 [ACK] Seq=29817 Ack=838 Win=275 Len=1460 [TCP segment of a reassembled PDU];;;;;;;;;;4,462134;4,462282;0,000148;;-0,000212;0,00036;0,000572
43;4,462282;10.120.93.121;118.98.113.218;TCP;54;61020  >  443 [ACK] Seq=838 Ack=31277 Win=524 Len=0;;;;;;;;;;4,462282;4,462642;0,00036;;0,00036;0;-0,00036
44;4,462642;118.98.113.218;10.120.93.121;TCP;1514;443  >  61020 [ACK] Seq=31277 Ack=838 Win=275 Len=1460 [TCP segment of a reassembled PDU];;;;;;;;;;4,462642;4,462642;0;;-0,000122;0,000122;0,000244
45;4,462642;118.98.113.218;10.120.93.121;TLSv1.2;1514;Application Data [TCP segment of a reassembled PDU];;;;;;;;;;4,462642;4,462764;0,000122;;-0,00012;0,000242;0,000362
46;4,462764;10.120.93.121;118.98.113.218;TCP;54;61020  >  443 [ACK] Seq=838 Ack=34197 Win=524 Len=0;;;;;;;;;;4,462764;4,463006;0,000242;;0,000111;0,000131;0,00002
47;4,463006;118.98.113.218;10.120.93.121;TCP;1514;443  >  61020 [ACK] Seq=34197 Ack=838 Win=275 Len=1460 [TCP segment of a reassembled PDU];;;;;;;;;;4,463006;4,463137;0,000131;;0,000131;0;-0,000131
48;4,463137;118.98.113.218;10.120.93.121;TCP;1514;443  >  61020 [ACK] Seq=35657 Ack=838 Win=275 Len=1460 [TCP segment of a reassembled PDU];;;;;;;;;;4,463137;4,463137;0;;-0,000098;9,80E-05;0,000196
49;4,463137;118.98.113.218;10.120.93.121;TCP;1514;443  >  61020 [ACK] Seq=37117 Ack=838 Win=275 Len=1460 [TCP segment of a reassembled PDU];;;;;;;;;;4,463137;4,463235;9,80E-05;;-0,002728;0,002826;0,005554
50;4,463235;10.120.93.121;118.98.113.218;TCP;54;61020  >  443 [ACK] Seq=838 Ack=38577 Win=524 Len=0;;;;;;;;;;4,463235;4,466061;0,002826;;0,002826;0;-0,002826
51;4,466061;118.98.113.218;10.120.93.121;TCP;1514;443  >  61020 [ACK] Seq=38577 Ack=838 Win=275 Len=1460 [TCP segment of a reassembled PDU];;;;;;;;;;4,466061;4,466061;0;;-0,000164;0,000164;0,000328
52;4,466061;118.98.113.218;10.120.93.121;TLSv1.2;1514;Application Data [TCP segment of a reassembled PDU];;;;;;;;;;4,466061;4,466225;0,000164;;-0,000058;0,000222;0,00028
53;4,466225;10.120.93.121;118.98.113.218;TCP;54;61020  >  443 [ACK] Seq=838 Ack=41497 Win=524 Len=0;;;;;;;;;;4,466225;4,466447;0,000222;;0,000222;0;-0,000222
54;4,466447;118.98.113.218;10.120.93.121;TCP;1514;[TCP Previous segment not captured] 443  >  61020 [ACK] Seq=42957 Ack=838 Win=275 Len=1460 [TCP segment of a reassembled PDU];;;;;;;;;;4,466447;4,466447;0;;-0,000174;0,000174;0,000348
55;4,466447;118.98.113.218;10.120.93.121;TCP;1514;[TCP Out-Of-Order] 443  >  61020 [ACK] Seq=41497 Ack=838 Win=275 Len=1460 [TCP segment of a reassembled PDU];;;;;;;;;;4,466447;4,466621;0,000174;;0,000052;0,000122;0,00007
56;4,466621;10.120.93.121;118.98.113.218;TCP;66;[TCP Dup ACK 53#1] 61020  >  443 [ACK] Seq=838 Ack=41497 Win=524 Len=0 SLE=42957 SRE=44417;;;;;;;;;;4,466621;4,466743;0,000122;;-0,000491;0,000613;0,001104
57;4,466743;10.120.93.121;118.98.113.218;TCP;54;61020  >  443 [ACK] Seq=838 Ack=44417 Win=524 Len=0;;;;;;;;;;4,466743;4,467356;0,000613;;0,000613;0;-0,000613
58;4,467356;118.98.113.218;10.120.93.121;TCP;1514;443  >  61020 [ACK] Seq=44417 Ack=838 Win=275 Len=1460 [TCP segment of a reassembled PDU];;;;;;;;;;4,467356;4,467356;0;;-0,000113;0,000113;0,000226
59;4,467356;118.98.113.218;10.120.93.121;TCP;1514;443  >  61020 [ACK] Seq=45877 Ack=838 Win=275 Len=1460 [TCP segment of a reassembled PDU];;;;;;;;;;4,467356;4,467469;0,000113;;-0,006819;0,006932;0,013751
60;4,467469;10.120.93.121;118.98.113.218;TCP;54;61020  >  443 [ACK] Seq=838 Ack=47337 Win=524 Len=0;;;;;;;;;;4,467469;4,474401;0,006932;;0,006932;0;-0,006932
61;4,474401;118.98.113.218;10.120.93.121;TCP;1514;443  >  61020 [ACK] Seq=47337 Ack=838 Win=275 Len=1460 [TCP segment of a reassembled PDU];;;;;;;;;;4,474401;4,474401;0;;-0,000139;0,000139;0,000278
62;4,474401;118.98.113.218;10.120.93.121;TCP;1514;443  >  61020 [ACK] Seq=48797 Ack=838 Win=275 Len=1460 [TCP segment of a reassembled PDU];;;;;;;;;;4,474401;4,47454;0,000139;;3,00E-06;0,000136;0,000133
63;4,47454;10.120.93.121;118.98.113.218;TCP;54;61020  >  443 [ACK] Seq=838 Ack=50257 Win=524 Len=0;;;;;;;;;;4,47454;4,474676;0,000136;;0,000136;0;-0,000136
64;4,474676;118.98.113.218;10.120.93.121;TCP;1514;[TCP Previous segment not captured] 443  >  61020 [ACK] Seq=51717 Ack=838 Win=275 Len=1460 [TCP segment of a reassembled PDU];;;;;;;;;;4,474676;4,474676;0;;-0,000046;4,60E-05;0,000092
65;4,474676;118.98.113.218;10.120.93.121;TCP;1514;[TCP Out-Of-Order] 443  >  61020 [ACK] Seq=50257 Ack=838 Win=275 Len=1460 [TCP segment of a reassembled PDU];;;;;;;;;;4,474676;4,474722;4,60E-05;;-0,000005;5,10E-05;0,000056
66;4,474722;10.120.93.121;118.98.113.218;TCP;66;[TCP Dup ACK 63#1] 61020  >  443 [ACK] Seq=838 Ack=50257 Win=524 Len=0 SLE=51717 SRE=53177;;;;;;;;;;4,474722;4,474773;5,10E-05;;-0,00003;8,10E-05;0,000111
67;4,474773;10.120.93.121;118.98.113.218;TCP;54;61020  >  443 [ACK] Seq=838 Ack=53177 Win=524 Len=0;;;;;;;;;;4,474773;4,474854;8,10E-05;;0,000049;3,20E-05;-0,000017
68;4,474854;118.98.113.218;10.120.93.121;TCP;1514;443  >  61020 [ACK] Seq=53177 Ack=838 Win=275 Len=1460 [TCP segment of a reassembled PDU];;;;;;;;;;4,474854;4,474886;3,20E-05;;-0,000786;0,000818;0,001604
69;4,474886;10.120.93.121;118.98.113.218;TCP;54;61020  >  443 [ACK] Seq=838 Ack=54637 Win=524 Len=0;;;;;;;;;;4,474886;4,475704;0,000818;;-0,001871;0,002689;0,00456
70;4,475704;118.98.113.218;10.120.93.121;TCP;1514;443  >  61020 [ACK] Seq=54637 Ack=838 Win=275 Len=1460 [TCP segment of a reassembled PDU];;;;;;;;;;4,475704;4,478393;0,002689;;0,002689;0;-0,002689
71;4,478393;118.98.113.218;10.120.93.121;TLSv1.2;1514;Application Data [TCP segment of a reassembled PDU];;;;;;;;;;4,478393;4,478393;0;;-0,00007;7,00E-05;0,00014
72;4,478393;118.98.113.218;10.120.93.121;TCP;1514;443  >  61020 [ACK] Seq=57557 Ack=838 Win=275 Len=1460 [TCP segment of a reassembled PDU];;;;;;;;;;4,478393;4,478463;7,00E-05;;-0,00202;0,00209;0,00411
73;4,478463;10.120.93.121;118.98.113.218;TCP;54;61020  >  443 [ACK] Seq=838 Ack=59017 Win=524 Len=0;;;;;;;;;;4,478463;4,480553;0,00209;;0,00209;0;-0,00209
74;4,480553;118.98.113.218;10.120.93.121;TCP;1514;[TCP Previous segment not captured] 443  >  61020 [ACK] Seq=60477 Ack=838 Win=275 Len=1460 [TCP segment of a reassembled PDU];;;;;;;;;;4,480553;4,480553;0;;-0,000108;0,000108;0,000216
75;4,480553;118.98.113.218;10.120.93.121;TCP;1514;[TCP Out-Of-Order] 443  >  61020 [ACK] Seq=59017 Ack=838 Win=275 Len=1460 [TCP segment of a reassembled PDU];;;;;;;;;;4,480553;4,480661;0,000108;;0,000012;9,60E-05;0,000084
76;4,480661;10.120.93.121;118.98.113.218;TCP;66;[TCP Dup ACK 73#1] 61020  >  443 [ACK] Seq=838 Ack=59017 Win=524 Len=0 SLE=60477 SRE=61937;;;;;;;;;;4,480661;4,480757;9,60E-05;;-0,001755;0,001851;0,003606
77;4,480757;10.120.93.121;118.98.113.218;TCP;54;61020  >  443 [ACK] Seq=838 Ack=61937 Win=524 Len=0;;;;;;;;;;4,480757;4,482608;0,001851;;0,001851;0;-0,001851
78;4,482608;118.98.113.218;10.120.93.121;TCP;1514;443  >  61020 [ACK] Seq=61937 Ack=838 Win=275 Len=1460 [TCP segment of a reassembled PDU];;;;;;;;;;4,482608;4,482608;0;;-0,000099;9,90E-05;0,000198
79;4,482608;118.98.113.218;10.120.93.121;TCP;1514;443  >  61020 [ACK] Seq=63397 Ack=838 Win=275 Len=1460 [TCP segment of a reassembled PDU];;;;;;;;;;4,482608;4,482707;9,90E-05;;-0,001901;0,002;0,003901
80;4,482707;10.120.93.121;118.98.113.218;TCP;54;61020  >  443 [ACK] Seq=838 Ack=64857 Win=524 Len=0;;;;;;;;;;4,482707;4,484707;0,002;;0,002;0;-0,002
81;4,484707;118.98.113.218;10.120.93.121;TCP;1514;443  >  61020 [ACK] Seq=64857 Ack=838 Win=275 Len=1460 [TCP segment of a reassembled PDU];;;;;;;;;;4,484707;4,484707;0;;-0,000079;7,90E-05;0,000158
82;4,484707;118.98.113.218;10.120.93.121;TCP;1514;443  >  61020 [ACK] Seq=66317 Ack=838 Win=275 Len=1460 [TCP segment of a reassembled PDU];;;;;;;;;;4,484707;4,484786;7,90E-05;;-0,002205;0,002284;0,004489
83;4,484786;10.120.93.121;118.98.113.218;TCP;54;61020  >  443 [ACK] Seq=838 Ack=67777 Win=524 Len=0;;;;;;;;;;4,484786;4,48707;0,002284;;0,002284;0;-0,002284
84;4,48707;118.98.113.218;10.120.93.121;TCP;1514;[TCP Previous segment not captured] 443  >  61020 [ACK] Seq=69237 Ack=838 Win=275 Len=1460 [TCP segment of a reassembled PDU];;;;;;;;;;4,48707;4,48707;0;;-0,000096;9,60E-05;0,000192
85;4,48707;118.98.113.218;10.120.93.121;TCP;1514;[TCP Out-Of-Order] 443  >  61020 [ACK] Seq=67777 Ack=838 Win=275 Len=1460 [TCP segment of a reassembled PDU];;;;;;;;;;4,48707;4,487166;9,60E-05;;0,000009;8,70E-05;0,000078
86;4,487166;10.120.93.121;118.98.113.218;TCP;66;[TCP Dup ACK 83#1] 61020  >  443 [ACK] Seq=838 Ack=67777 Win=524 Len=0 SLE=69237 SRE=70697;;;;;;;;;;4,487166;4,487253;8,70E-05;;-0,001774;0,001861;0,003635
87;4,487253;10.120.93.121;118.98.113.218;TCP;54;61020  >  443 [ACK] Seq=838 Ack=70697 Win=524 Len=0;;;;;;;;;;4,487253;4,489114;0,001861;;0,001861;0;-0,001861
88;4,489114;118.98.113.218;10.120.93.121;TCP;1514;443  >  61020 [ACK] Seq=70697 Ack=838 Win=275 Len=1460 [TCP segment of a reassembled PDU];;;;;;;;;;4,489114;4,489114;0;;-0,000066;6,60E-05;0,000132
89;4,489114;118.98.113.218;10.120.93.121;TCP;1514;443  >  61020 [ACK] Seq=72157 Ack=838 Win=275 Len=1460 [TCP segment of a reassembled PDU];;;;;;;;;;4,489114;4,48918;6,60E-05;;-0,001976;0,002042;0,004018
90;4,48918;10.120.93.121;118.98.113.218;TCP;54;61020  >  443 [ACK] Seq=838 Ack=73617 Win=524 Len=0;;;;;;;;;;4,48918;4,491222;0,002042;;0,002042;0;-0,002042
91;4,491222;118.98.113.218;10.120.93.121;TLSv1.2;1514;Application Data [TCP segment of a reassembled PDU];;;;;;;;;;4,491222;4,491222;0;;-0,000067;6,70E-05;0,000134
92;4,491222;118.98.113.218;10.120.93.121;TCP;1514;443  >  61020 [ACK] Seq=75077 Ack=838 Win=275 Len=1460 [TCP segment of a reassembled PDU];;;;;;;;;;4,491222;4,491289;6,70E-05;;-0,002005;0,002072;0,004077
93;4,491289;10.120.93.121;118.98.113.218;TCP;54;61020  >  443 [ACK] Seq=838 Ack=76537 Win=524 Len=0;;;;;;;;;;4,491289;4,493361;0,002072;;0,002072;0;-0,002072
94;4,493361;118.98.113.218;10.120.93.121;TCP;1514;[TCP Previous segment not captured] 443  >  61020 [ACK] Seq=77997 Ack=838 Win=275 Len=1460 [TCP segment of a reassembled PDU];;;;;;;;;;4,493361;4,493361;0;;-0,000097;9,70E-05;0,000194
95;4,493361;118.98.113.218;10.120.93.121;TCP;1514;[TCP Out-Of-Order] 443  >  61020 [ACK] Seq=76537 Ack=838 Win=275 Len=1460 [TCP segment of a reassembled PDU];;;;;;;;;;4,493361;4,493458;9,70E-05;;7,00E-06;9,00E-05;0,000083
96;4,493458;10.120.93.121;118.98.113.218;TCP;66;[TCP Dup ACK 93#1] 61020  >  443 [ACK] Seq=838 Ack=76537 Win=524 Len=0 SLE=77997 SRE=79457;;;;;;;;;;4,493458;4,493548;9,00E-05;;-0,004269;0,004359;0,008628
97;4,493548;10.120.93.121;118.98.113.218;TCP;54;61020  >  443 [ACK] Seq=838 Ack=79457 Win=524 Len=0;;;;;;;;;;4,493548;4,497907;0,004359;;0,004359;0;-0,004359
98;4,497907;118.98.113.218;10.120.93.121;TCP;1514;443  >  61020 [ACK] Seq=79457 Ack=838 Win=275 Len=1460 [TCP segment of a reassembled PDU];;;;;;;;;;4,497907;4,497907;0;;-0,000072;7,20E-05;0,000144
99;4,497907;118.98.113.218;10.120.93.121;TLSv1.2;1514;Application Data [TCP segment of a reassembled PDU];;;;;;;;;;4,497907;4,497979;7,20E-05;;-0,001967;0,002039;0,004006
100;4,497979;10.120.93.121;118.98.113.218;TCP;54;61020  >  443 [ACK] Seq=838 Ack=82377 Win=524 Len=0;;;;;;;;;;4,497979;4,500018;0,002039;;0,002039;0;-0,002039
101;4,500018;118.98.113.218;10.120.93.121;TCP;1514;[TCP Previous segment not captured] 443  >  61020 [ACK] Seq=83837 Ack=838 Win=275 Len=1460 [TCP segment of a reassembled PDU];;;;;;;;;;4,500018;4,500018;0;;-0,000129;0,000129;0,000258
102;4,500018;118.98.113.218;10.120.93.121;TCP;1514;[TCP Out-Of-Order] 443  >  61020 [ACK] Seq=82377 Ack=838 Win=275 Len=1460 [TCP segment of a reassembled PDU];;;;;;;;;;4,500018;4,500147;0,000129;;0,000034;9,50E-05;0,000061
103;4,500147;10.120.93.121;118.98.113.218;TCP;66;[TCP Dup ACK 100#1] 61020  >  443 [ACK] Seq=838 Ack=82377 Win=524 Len=0 SLE=83837 SRE=85297;;;;;;;;;;4,500147;4,500242;9,50E-05;;-0,004696;0,004791;0,009487
104;4,500242;10.120.93.121;118.98.113.218;TCP;54;61020  >  443 [ACK] Seq=838 Ack=85297 Win=524 Len=0;;;;;;;;;;4,500242;4,505033;0,004791;;0,004791;0;-0,004791
105;4,505033;118.98.113.218;10.120.93.121;TCP;1514;443  >  61020 [ACK] Seq=85297 Ack=838 Win=275 Len=1460 [TCP segment of a reassembled PDU];;;;;;;;;;4,505033;4,505033;0;;-0,00012;0,00012;0,00024
106;4,505033;118.98.113.218;10.120.93.121;TCP;1514;443  >  61020 [ACK] Seq=86757 Ack=838 Win=275 Len=1460 [TCP segment of a reassembled PDU];;;;;;;;;;4,505033;4,505153;0,00012;;-0,00387;0,00399;0,00786
107;4,505153;10.120.93.121;118.98.113.218;TCP;54;61020  >  443 [ACK] Seq=838 Ack=88217 Win=524 Len=0;;;;;;;;;;4,505153;4,509143;0,00399;;0,00399;0;-0,00399
108;4,509143;118.98.113.218;10.120.93.121;TCP;1514;443  >  61020 [ACK] Seq=88217 Ack=838 Win=275 Len=1460 [TCP segment of a reassembled PDU];;;;;;;;;;4,509143;4,509143;0;;-0,000065;6,50E-05;0,00013
109;4,509143;118.98.113.218;10.120.93.121;TCP;1514;443  >  61020 [ACK] Seq=89677 Ack=838 Win=275 Len=1460 [TCP segment of a reassembled PDU];;;;;;;;;;4,509143;4,509208;6,50E-05;;-0,000028;9,30E-05;0,000121
110;4,509208;10.120.93.121;118.98.113.218;TCP;54;61020  >  443 [ACK] Seq=838 Ack=91137 Win=524 Len=0;;;;;;;;;;4,509208;4,509301;9,30E-05;;0,000053;4,00E-05;-0,000013
111;4,509301;118.98.113.218;10.120.93.121;TCP;1514;[TCP Previous segment not captured] 443  >  61020 [ACK] Seq=92597 Ack=838 Win=275 Len=1460 [TCP segment of a reassembled PDU];;;;;;;;;;4,509301;4,509341;4,00E-05;;-0,001842;0,001882;0,003724
112;4,509341;10.120.93.121;118.98.113.218;TCP;66;[TCP Dup ACK 110#1] 61020  >  443 [ACK] Seq=838 Ack=91137 Win=524 Len=0 SLE=92597 SRE=94057;;;;;;;;;;4,509341;4,511223;0,001882;;0,001882;0;-0,001882
113;4,511223;118.98.113.218;10.120.93.121;TCP;1514;[TCP Out-Of-Order] 443  >  61020 [ACK] Seq=91137 Ack=838 Win=275 Len=1460 [TCP segment of a reassembled PDU];;;;;;;;;;4,511223;4,511223;0;;-0,000085;8,50E-05;0,00017
114;4,511223;118.98.113.218;10.120.93.121;TCP;1514;443  >  61020 [ACK] Seq=94057 Ack=838 Win=275 Len=1460 [TCP segment of a reassembled PDU];;;;;;;;;;4,511223;4,511308;8,50E-05;;0,00002;6,50E-05;0,000045
115;4,511308;10.120.93.121;118.98.113.218;TCP;54;61020  >  443 [ACK] Seq=838 Ack=94057 Win=524 Len=0;;;;;;;;;;4,511308;4,511373;6,50E-05;;-0,002001;0,002066;0,004067
116;4,511373;10.120.93.121;118.98.113.218;TCP;54;61020  >  443 [ACK] Seq=838 Ack=95517 Win=524 Len=0;;;;;;;;;;4,511373;4,513439;0,002066;;0,002066;0;-0,002066
117;4,513439;118.98.113.218;10.120.93.121;TCP;1514;443  >  61020 [ACK] Seq=95517 Ack=838 Win=275 Len=1460 [TCP segment of a reassembled PDU];;;;;;;;;;4,513439;4,513439;0;;-0,00011;0,00011;0,00022
118;4,513439;118.98.113.218;10.120.93.121;TLSv1.2;1514;Application Data [TCP segment of a reassembled PDU];;;;;;;;;;4,513439;4,513549;0,00011;;-0,002461;0,002571;0,005032
119;4,513549;10.120.93.121;118.98.113.218;TCP;54;61020  >  443 [ACK] Seq=838 Ack=98437 Win=524 Len=0;;;;;;;;;;4,513549;4,51612;0,002571;;0,000463;0,002108;0,001645
120;4,51612;118.98.113.218;10.120.93.121;TCP;1514;443  >  61020 [ACK] Seq=98437 Ack=838 Win=275 Len=1460 [TCP segment of a reassembled PDU];;;;;;;;;;4,51612;4,518228;0,002108;;0,002108;0;-0,002108
121;4,518228;118.98.113.218;10.120.93.121;TCP;1514;443  >  61020 [ACK] Seq=99897 Ack=838 Win=275 Len=1460 [TCP segment of a reassembled PDU];;;;;;;;;;4,518228;4,518228;0;;-0,000082;8,20E-05;0,000164
122;4,518228;118.98.113.218;10.120.93.121;TCP;1514;443  >  61020 [ACK] Seq=101357 Ack=838 Win=275 Len=1460 [TCP segment of a reassembled PDU];;;;;;;;;;4,518228;4,51831;8,20E-05;;-0,002519;0,002601;0,00512
123;4,51831;10.120.93.121;118.98.113.218;TCP;54;61020  >  443 [ACK] Seq=838 Ack=102817 Win=524 Len=0;;;;;;;;;;4,51831;4,520911;0,002601;;0,002601;0;-0,002601
124;4,520911;118.98.113.218;10.120.93.121;TCP;1514;443  >  61020 [ACK] Seq=102817 Ack=838 Win=275 Len=1460 [TCP segment of a reassembled PDU];;;;;;;;;;4,520911;4,520911;0;;-0,000104;0,000104;0,000208
125;4,520911;118.98.113.218;10.120.93.121;TCP;1514;443  >  61020 [ACK] Seq=104277 Ack=838 Win=275 Len=1460 [TCP segment of a reassembled PDU];;;;;;;;;;4,520911;4,521015;0,000104;;-0,004784;0,004888;0,009672
126;4,521015;10.120.93.121;118.98.113.218;TCP;54;61020  >  443 [ACK] Seq=838 Ack=105737 Win=524 Len=0;;;;;;;;;;4,521015;4,525903;0,004888;;0,004888;0;-0,004888
127;4,525903;118.98.113.218;10.120.93.121;TCP;1514;443  >  61020 [ACK] Seq=105737 Ack=838 Win=275 Len=1460 [TCP segment of a reassembled PDU];;;;;;;;;;4,525903;4,525903;0;;-0,000086;8,60E-05;0,000172
128;4,525903;118.98.113.218;10.120.93.121;TCP;1514;443  >  61020 [ACK] Seq=107197 Ack=838 Win=275 Len=1460 [TCP segment of a reassembled PDU];;;;;;;;;;4,525903;4,525989;8,60E-05;;-0,001942;0,002028;0,00397
129;4,525989;10.120.93.121;118.98.113.218;TCP;54;61020  >  443 [ACK] Seq=838 Ack=108657 Win=524 Len=0;;;;;;;;;;4,525989;4,528017;0,002028;;0,002028;0;-0,002028
130;4,528017;118.98.113.218;10.120.93.121;TCP;1514;443  >  61020 [ACK] Seq=108657 Ack=838 Win=275 Len=1460 [TCP segment of a reassembled PDU];;;;;;;;;;4,528017;4,528017;0;;-0,000059;5,90E-05;0,000118
131;4,528017;118.98.113.218;10.120.93.121;TCP;1514;443  >  61020 [ACK] Seq=110117 Ack=838 Win=275 Len=1460 [TCP segment of a reassembled PDU];;;;;;;;;;4,528017;4,528076;5,90E-05;;-0,002025;0,002084;0,004109
132;4,528076;10.120.93.121;118.98.113.218;TCP;54;61020  >  443 [ACK] Seq=838 Ack=111577 Win=524 Len=0;;;;;;;;;;4,528076;4,53016;0,002084;;0,002084;0;-0,002084
133;4,53016;118.98.113.218;10.120.93.121;TCP;1514;443  >  61020 [ACK] Seq=111577 Ack=838 Win=275 Len=1460 [TCP segment of a reassembled PDU];;;;;;;;;;4,53016;4,53016;0;;-0,000062;6,20E-05;0,000124
134;4,53016;118.98.113.218;10.120.93.121;TCP;1514;443  >  61020 [ACK] Seq=113037 Ack=838 Win=275 Len=1460 [TCP segment of a reassembled PDU];;;;;;;;;;4,53016;4,530222;6,20E-05;;-0,002411;0,002473;0,004884
135;4,530222;10.120.93.121;118.98.113.218;TCP;54;61020  >  443 [ACK] Seq=838 Ack=114497 Win=524 Len=0;;;;;;;;;;4,530222;4,532695;0,002473;;0,002473;0;-0,002473
136;4,532695;118.98.113.218;10.120.93.121;TLSv1.2;1514;[TCP Previous segment not captured] , Ignored Unknown Record;;;;;;;;;;4,532695;4,532695;0;;-0,000114;0,000114;0,000228
137;4,532695;118.98.113.218;10.120.93.121;TCP;1514;[TCP Out-Of-Order] 443  >  61020 [ACK] Seq=114497 Ack=838 Win=275 Len=1460;;;;;;;;;;4,532695;4,532809;0,000114;;0,000013;0,000101;0,000088
138;4,532809;10.120.93.121;118.98.113.218;TCP;66;[TCP Dup ACK 135#1] 61020  >  443 [ACK] Seq=838 Ack=114497 Win=524 Len=0 SLE=115957 SRE=117417;;;;;;;;;;4,532809;4,53291;0,000101;;-0,004425;0,004526;0,008951
139;4,53291;10.120.93.121;118.98.113.218;TCP;54;61020  >  443 [ACK] Seq=838 Ack=117417 Win=524 Len=0;;;;;;;;;;4,53291;4,537436;0,004526;;0,004526;0;-0,004526
140;4,537436;118.98.113.218;10.120.93.121;TLSv1.2;1514;Ignored Unknown Record;;;;;;;;;;4,537436;4,537436;0;;-0,000128;0,000128;0,000256
141;4,537436;118.98.113.218;10.120.93.121;TLSv1.2;1514;Ignored Unknown Record;;;;;;;;;;4,537436;4,537564;0,000128;;-0,013617;0,013745;0,027362
142;4,537564;10.120.93.121;118.98.113.218;TCP;54;61020  >  443 [ACK] Seq=838 Ack=120337 Win=524 Len=0;;;;;;;;;;4,537564;4,551309;0,013745;;0,013745;0;-0,013745
143;4,551309;118.98.113.218;10.120.93.121;TLSv1.2;1514;[TCP Previous segment not captured] , Ignored Unknown Record;;;;;;;;;;4,551309;4,551309;0;;-0,000114;0,000114;0,000228
144;4,551309;118.98.113.218;10.120.93.121;TCP;1514;[TCP Out-Of-Order] 443  >  61020 [ACK] Seq=120337 Ack=838 Win=275 Len=1460;;;;;;;;;;4,551309;4,551423;0,000114;;0,000018;9,60E-05;0,000078
145;4,551423;10.120.93.121;118.98.113.218;TCP;66;[TCP Dup ACK 142#1] 61020  >  443 [ACK] Seq=838 Ack=120337 Win=524 Len=0 SLE=121797 SRE=123257;;;;;;;;;;4,551423;4,551519;9,60E-05;;-0,008074;0,00817;0,016244
146;4,551519;10.120.93.121;118.98.113.218;TCP;54;61020  >  443 [ACK] Seq=838 Ack=123257 Win=524 Len=0;;;;;;;;;;4,551519;4,559689;0,00817;;0,00817;0;-0,00817
147;4,559689;118.98.113.218;10.120.93.121;TLSv1.2;1514;Ignored Unknown Record;;;;;;;;;;4,559689;4,559689;0;;-0,000113;0,000113;0,000226
148;4,559689;118.98.113.218;10.120.93.121;TLSv1.2;1514;Ignored Unknown Record;;;;;;;;;;4,559689;4,559802;0,000113;;-0,003989;0,004102;0,008091
149;4,559802;10.120.93.121;118.98.113.218;TCP;54;61020  >  443 [ACK] Seq=838 Ack=126177 Win=524 Len=0;;;;;;;;;;4,559802;4,563904;0,004102;;0,004102;0;-0,004102
150;4,563904;118.98.113.218;10.120.93.121;TLSv1.2;1514;[TCP Previous segment not captured] , Ignored Unknown Record;;;;;;;;;;4,563904;4,563904;0;;-0,000113;0,000113;0,000226
151;4,563904;118.98.113.218;10.120.93.121;TCP;1514;[TCP Out-Of-Order] 443  >  61020 [ACK] Seq=126177 Ack=838 Win=275 Len=1460;;;;;;;;;;4,563904;4,564017;0,000113;;0,000013;0,0001;0,000087
152;4,564017;10.120.93.121;118.98.113.218;TCP;66;[TCP Dup ACK 149#1] 61020  >  443 [ACK] Seq=838 Ack=126177 Win=524 Len=0 SLE=127637 SRE=129097;;;;;;;;;;4,564017;4,564117;0,0001;;-0,006555;0,006655;0,01321
153;4,564117;10.120.93.121;118.98.113.218;TCP;54;61020  >  443 [ACK] Seq=838 Ack=129097 Win=524 Len=0;;;;;;;;;;4,564117;4,570772;0,006655;;0,006655;0;-0,006655
154;4,570772;118.98.113.218;10.120.93.121;TLSv1.2;1514;[TCP Previous segment not captured] , Ignored Unknown Record;;;;;;;;;;4,570772;4,570772;0;;-0,000144;0,000144;0,000288
155;4,570772;118.98.113.218;10.120.93.121;TCP;1514;[TCP Out-Of-Order] 443  >  61020 [ACK] Seq=129097 Ack=838 Win=275 Len=1460;;;;;;;;;;4,570772;4,570916;0,000144;;0,000012;0,000132;0,00012
156;4,570916;10.120.93.121;118.98.113.218;TCP;66;[TCP Dup ACK 153#1] 61020  >  443 [ACK] Seq=838 Ack=129097 Win=524 Len=0 SLE=130557 SRE=132017;;;;;;;;;;4,570916;4,571048;0,000132;;-0,00194;0,002072;0,004012
157;4,571048;10.120.93.121;118.98.113.218;TCP;54;61020  >  443 [ACK] Seq=838 Ack=132017 Win=524 Len=0;;;;;;;;;;4,571048;4,57312;0,002072;;0,002072;0;-0,002072
158;4,57312;118.98.113.218;10.120.93.121;TLSv1.2;1514;Ignored Unknown Record;;;;;;;;;;4,57312;4,57312;0;;-0,000148;0,000148;0,000296
159;4,57312;118.98.113.218;10.120.93.121;TLSv1.2;1514;Ignored Unknown Record;;;;;;;;;;4,57312;4,573268;0,000148;;-0,005889;0,006037;0,011926
160;4,573268;10.120.93.121;118.98.113.218;TCP;54;61020  >  443 [ACK] Seq=838 Ack=134937 Win=524 Len=0;;;;;;;;;;4,573268;4,579305;0,006037;;0,006037;0;-0,006037
161;4,579305;118.98.113.218;10.120.93.121;TLSv1.2;1514;Ignored Unknown Record;;;;;;;;;;4,579305;4,579305;0;;0;0;0
162;4,579305;118.98.113.218;10.120.93.121;TLSv1.2;1514;Ignored Unknown Record;;;;;;;;;;4,579305;4,579305;0;;-0,000161;0,000161;0,000322
163;4,579305;118.98.113.218;10.120.93.121;TLSv1.2;206;[TCP Previous segment not captured] , Ignored Unknown Record;;;;;;;;;;4,579305;4,579466;0,000161;;-0,006402;0,006563;0,012965
164;4,579466;10.120.93.121;118.98.113.218;TCP;66;61020  >  443 [ACK] Seq=838 Ack=137857 Win=524 Len=0 SLE=139317 SRE=139469;;;;;;;;;;4,579466;4,586029;0,006563;;0,006563;0;-0,006563
165;4,586029;118.98.113.218;10.120.93.121;TCP;1514;[TCP Retransmission] 443  >  61020 [ACK] Seq=137857 Ack=838 Win=275 Len=1460;;;;;;;;;;4,586029;4,586029;0;;-0,000156;0,000156;0,000312
166;4,586029;118.98.113.218;10.120.93.121;TLSv1.2;1514;[TCP Previous segment not captured] , Ignored Unknown Record;;;;;;;;;;4,586029;4,586185;0,000156;;0,000039;0,000117;0,000078
167;4,586185;10.120.93.121;118.98.113.218;TCP;54;61020  >  443 [ACK] Seq=838 Ack=139469 Win=524 Len=0;;;;;;;;;;4,586185;4,586302;0,000117;;-0,000056;0,000173;0,000229
168;4,586302;10.120.93.121;118.98.113.218;TCP;66;[TCP Dup ACK 167#1] 61020  >  443 [ACK] Seq=838 Ack=139469 Win=524 Len=0 SLE=140929 SRE=142389;;;;;;;;;;4,586302;4,586475;0,000173;;0,000091;8,20E-05;-0,000009
169;4,586475;118.98.113.218;10.120.93.121;TCP;1514;[TCP Out-Of-Order] 443  >  61020 [ACK] Seq=139469 Ack=838 Win=275 Len=1460;;;;;;;;;;4,586475;4,586557;8,20E-05;;-0,001137;0,001219;0,002356
170;4,586557;10.120.93.121;118.98.113.218;TCP;54;61020  >  443 [ACK] Seq=838 Ack=142389 Win=524 Len=0;;;;;;;;;;4,586557;4,587776;0,001219;;0,001219;0;-0,001219
171;4,587776;118.98.113.218;10.120.93.121;TLSv1.2;1514;Ignored Unknown Record;;;;;;;;;;4,587776;4,587776;0;;-0,000112;0,000112;0,000224
172;4,587776;118.98.113.218;10.120.93.121;TLSv1.2;1514;Ignored Unknown Record;;;;;;;;;;4,587776;4,587888;0,000112;;-0,002115;0,002227;0,004342
173;4,587888;10.120.93.121;118.98.113.218;TCP;54;61020  >  443 [ACK] Seq=838 Ack=145309 Win=524 Len=0;;;;;;;;;;4,587888;4,590115;0,002227;;0,002227;0;-0,002227
174;4,590115;118.98.113.218;10.120.93.121;TLSv1.2;1514;Ignored Unknown Record;;;;;;;;;;4,590115;4,590115;0;;-0,000117;0,000117;0,000234
175;4,590115;118.98.113.218;10.120.93.121;TLSv1.2;1514;Ignored Unknown Record;;;;;;;;;;4,590115;4,590232;0,000117;;-0,003004;0,003121;0,006125
176;4,590232;10.120.93.121;118.98.113.218;TCP;54;61020  >  443 [ACK] Seq=838 Ack=148229 Win=524 Len=0;;;;;;;;;;4,590232;4,593353;0,003121;;0,003121;0;-0,003121
177;4,593353;118.98.113.218;10.120.93.121;TLSv1.2;1514;Ignored Unknown Record;;;;;;;;;;4,593353;4,593353;0;;-0,000165;0,000165;0,00033
178;4,593353;118.98.113.218;10.120.93.121;TLSv1.2;1514;Ignored Unknown Record;;;;;;;;;;4,593353;4,593518;0,000165;;-0,000858;0,001023;0,001881
179;4,593518;10.120.93.121;118.98.113.218;TCP;54;61020  >  443 [ACK] Seq=838 Ack=151149 Win=1060 Len=0;;;;;;;;;;4,593518;4,594541;0,001023;;0,001023;0;-0,001023
180;4,594541;118.98.113.218;10.120.93.121;TLSv1.2;1514;Ignored Unknown Record;;;;;;;;;;4,594541;4,594541;0;;-0,000105;0,000105;0,00021
181;4,594541;118.98.113.218;10.120.93.121;TLSv1.2;1514;Ignored Unknown Record;;;;;;;;;;4,594541;4,594646;0,000105;;-0,002719;0,002824;0,005543
182;4,594646;10.120.93.121;118.98.113.218;TCP;54;61020  >  443 [ACK] Seq=838 Ack=154069 Win=1060 Len=0;;;;;;;;;;4,594646;4,59747;0,002824;;0,002702;0,000122;-0,00258
183;4,59747;118.98.113.218;10.120.93.121;TLSv1.2;1514;[TCP Previous segment not captured] , Ignored Unknown Record;;;;;;;;;;4,59747;4,597592;0,000122;;-0,001288;0,00141;0,002698
184;4,597592;10.120.93.121;118.98.113.218;TCP;66;[TCP Dup ACK 182#1] 61020  >  443 [ACK] Seq=838 Ack=154069 Win=1060 Len=0 SLE=155529 SRE=156989;;;;;;;;;;4,597592;4,599002;0,00141;;0,00141;0;-0,00141
185;4,599002;118.98.113.218;10.120.93.121;TCP;1514;[TCP Out-Of-Order] 443  >  61020 [ACK] Seq=154069 Ack=838 Win=275 Len=1460;;;;;;;;;;4,599002;4,599002;0;;-0,000126;0,000126;0,000252
186;4,599002;118.98.113.218;10.120.93.121;TCP;1514;443  >  61020 [ACK] Seq=156989 Ack=838 Win=275 Len=1460;;;;;;;;;;4,599002;4,599128;0,000126;;-0,002289;0,002415;0,004704
187;4,599128;10.120.93.121;118.98.113.218;TCP;54;61020  >  443 [ACK] Seq=838 Ack=156989 Win=1060 Len=0;;;;;;;;;;4,599128;4,601543;0,002415;;0,002415;0;-0,002415
188;4,601543;118.98.113.218;10.120.93.121;TLSv1.2;1514;Ignored Unknown Record;;;;;;;;;;4,601543;4,601543;0;;-0,000156;0,000156;0,000312
189;4,601543;118.98.113.218;10.120.93.121;TLSv1.2;1514;Ignored Unknown Record;;;;;;;;;;4,601543;4,601699;0,000156;;-0,00182;0,001976;0,003796
190;4,601699;10.120.93.121;118.98.113.218;TCP;54;61020  >  443 [ACK] Seq=838 Ack=161369 Win=1060 Len=0;;;;;;;;;;4,601699;4,603675;0,001976;;0,001976;0;-0,001976
191;4,603675;118.98.113.218;10.120.93.121;TLSv1.2;1514;Ignored Unknown Record;;;;;;;;;;4,603675;4,603675;0;;-0,000144;0,000144;0,000288
192;4,603675;118.98.113.218;10.120.93.121;TLSv1.2;1514;Ignored Unknown Record;;;;;;;;;;4,603675;4,603819;0,000144;;-0,006282;0,006426;0,012708
193;4,603819;10.120.93.121;118.98.113.218;TCP;54;61020  >  443 [ACK] Seq=838 Ack=164289 Win=1060 Len=0;;;;;;;;;;4,603819;4,610245;0,006426;;0,006426;0;-0,006426
194;4,610245;118.98.113.218;10.120.93.121;TLSv1.2;1514;Ignored Unknown Record;;;;;;;;;;4,610245;4,610245;0;;-0,000158;0,000158;0,000316
195;4,610245;118.98.113.218;10.120.93.121;TLSv1.2;454;Ignored Unknown Record;;;;;;;;;;4,610245;4,610403;0,000158;;-5,450043;5,450201;10,900244
196;4,610403;10.120.93.121;118.98.113.218;TCP;54;61020  >  443 [ACK] Seq=838 Ack=166149 Win=1060 Len=0;;;;;;;;;;4,610403;10,060604;5,450201;;5,430272;0,019929;-5,410343
197;10,060604;10.120.93.121;199.232.46.248;TCP;55;60988  >  443 [ACK] Seq=1 Ack=1 Win=256 Len=1 [TCP segment of a reassembled PDU];;;;;;;;;;10,060604;10,080533;0,019929;;0,019895;3,40E-05;-0,019861
198;10,080533;10.120.93.121;199.232.46.248;TCP;55;60990  >  443 [ACK] Seq=1 Ack=1 Win=256 Len=1 [TCP segment of a reassembled PDU];;;;;;;;;;10,080533;10,080567;3,40E-05;;-0,000154;0,000188;0,000342
199;10,080567;10.120.93.121;199.232.46.248;TCP;55;60991  >  443 [ACK] Seq=1 Ack=1 Win=256 Len=1 [TCP segment of a reassembled PDU];;;;;;;;;;10,080567;10,080755;0,000188;;-0,002115;0,002303;0,004418
200;10,080755;10.120.93.121;199.232.46.248;TCP;55;60989  >  443 [ACK] Seq=1 Ack=1 Win=252 Len=1 [TCP segment of a reassembled PDU];;;;;;;;;;10,080755;10,083058;0,002303;;-0,018652;0,020955;0,039607
201;10,083058;199.232.46.248;10.120.93.121;TCP;66;443  >  60988 [ACK] Seq=1 Ack=2 Win=290 Len=0 SLE=1 SRE=2;;;;;;;;;;10,083058;10,104013;0,020955;;0,020955;0;-0,020955
202;10,104013;199.232.46.248;10.120.93.121;TCP;66;443  >  60990 [ACK] Seq=1 Ack=2 Win=290 Len=0 SLE=1 SRE=2;;;;;;;;;;10,104013;10,104013;0;;0;0;0
203;10,104013;199.232.46.248;10.120.93.121;TCP;66;443  >  60991 [ACK] Seq=1 Ack=2 Win=290 Len=0 SLE=1 SRE=2;;;;;;;;;;10,104013;10,104013;0;;-1,486203;1,486203;2,972406
204;10,104013;199.232.46.248;10.120.93.121;TCP;66;443  >  60989 [ACK] Seq=1 Ack=2 Win=290 Len=0 SLE=1 SRE=2;;;;;;;;;;10,104013;11,590216;1,486203;;1,455763;0,03044;-1,425323
205;11,590216;10.120.93.121;142.251.10.95;TCP;55;60911  >  443 [ACK] Seq=1 Ack=1 Win=255 Len=1 [TCP segment of a reassembled PDU];;;;;;;;;;11,590216;11,620656;0,03044;;-0,009316;0,039756;0,049072
206;11,620656;142.251.10.95;10.120.93.121;TCP;66;443  >  60911 [ACK] Seq=1 Ack=2 Win=273 Len=0 SLE=1 SRE=2;;;;;;;;;;11,620656;11,660412;0,039756;;0,017862;0,021894;0,004032
207;11,660412;10.120.93.121;172.217.194.94;TCP;55;60929  >  443 [ACK] Seq=1 Ack=1 Win=252 Len=1 [TCP segment of a reassembled PDU];;;;;;;;;;11,660412;11,682306;0,021894;;-0,246438;0,268332;0,51477
208;11,682306;172.217.194.94;10.120.93.121;TCP;66;443  >  60929 [ACK] Seq=1 Ack=2 Win=265 Len=0 SLE=1 SRE=2;;;;;;;;;;11,682306;11,950638;0,268332;;0,246278;0,022054;-0,224224
209;11,950638;10.120.93.121;151.101.194.91;TCP;55;60969  >  443 [ACK] Seq=1 Ack=1 Win=252 Len=1 [TCP segment of a reassembled PDU];;;;;;;;;;11,950638;11,972692;0,022054;;-0,168111;0,190165;0,358276
210;11,972692;151.101.194.91;10.120.93.121;TCP;66;443  >  60969 [ACK] Seq=1 Ack=2 Win=290 Len=0 SLE=1 SRE=2;;;;;;;;;;11,972692;12,162857;0,190165;;-0,087252;0,277417;0,364669
211;12,162857;10.120.93.121;239.255.255.250;SSDP;215;M-SEARCH * HTTP/1.1 ;;;;;;;;;;12,162857;12,440274;0,277417;;0,246973;0,030444;-0,216529
212;12,440274;10.120.93.121;172.217.194.94;TCP;55;60970  >  443 [ACK] Seq=1 Ack=1 Win=256 Len=1 [TCP segment of a reassembled PDU];;;;;;;;;;12,440274;12,470718;0,030444;;-0,407572;0,438016;0,845588
213;12,470718;172.217.194.94;10.120.93.121;TCP;66;443  >  60970 [ACK] Seq=1 Ack=2 Win=265 Len=0 SLE=1 SRE=2;;;;;;;;;;12,470718;12,908734;0,438016;;0,437626;0,00039;-0,437236
214;12,908734;172.217.194.94;10.120.93.121;TLSv1.2;127;Application Data;;;;;;;;;;12,908734;12,909124;0,00039;;-0,020371;0,020761;0,041132
215;12,909124;10.120.93.121;172.217.194.94;TCP;54;60892  >  443 [FIN, ACK] Seq=1 Ack=74 Win=256 Len=0;;;;;;;;;;12,909124;12,929885;0,020761;;0,020649;0,000112;-0,020537
216;12,929885;172.217.194.94;10.120.93.121;TCP;60;443  >  60892 [FIN, ACK] Seq=74 Ack=2 Win=265 Len=0;;;;;;;;;;12,929885;12,929997;0,000112;;-0,241928;0,24204;0,483968
217;12,929997;10.120.93.121;172.217.194.94;TCP;54;60892  >  443 [ACK] Seq=2 Ack=75 Win=256 Len=0;;;;;;;;;;12,929997;13,172037;0,24204;;0,143656;0,098384;-0,045272
218;13,172037;10.120.93.121;239.255.255.250;SSDP;215;M-SEARCH * HTTP/1.1 ;;;;;;;;;;13,172037;13,270421;0,098384;;0,076366;0,022018;-0,054348
219;13,270421;10.120.93.121;74.125.24.94;TCP;55;60997  >  443 [ACK] Seq=1 Ack=1 Win=256 Len=1 [TCP segment of a reassembled PDU];;;;;;;;;;13,270421;13,292439;0,022018;;-0,736132;0,75815;1,494282
220;13,292439;74.125.24.94;10.120.93.121;TCP;66;443  >  60997 [ACK] Seq=1 Ack=2 Win=269 Len=0 SLE=1 SRE=2;;;;;;;;;;13,292439;14,050589;0,75815;;0,736187;0,021963;-0,714224
221;14,050589;10.120.93.121;199.232.46.248;TCP;55;60992  >  443 [ACK] Seq=1 Ack=1 Win=251 Len=1 [TCP segment of a reassembled PDU];;;;;;;;;;14,050589;14,072552;0,021963;;-0,078572;0,100535;0,179107
